{
  "schemaVersion": 1,
  "suite": {
    "id": "ruffneckk-d2rloader-suite",
    "latestPublicVersion": "1.3.0",
    "targetVersion": "1.3.1",
    "status": "package-ready",
    "releaseReady": true,
    "owner": "Vincent + Codex",
    "decisionDate": "2026-09-03"
  },
  "compatibility": {
    "policy": "native-fingerprint-fail-closed",
    "channels": [
      {
        "name": "Battle.net",
        "gameVersion": "3.3",
        "build": 93847,
        "status": "qualified",
        "claim": "Runtime-qualified on D2R 3.3.93847 with D2RLoader 1.2.1 beta preview 10."
      },
      {
        "name": "Steam",
        "gameVersion": "3.3",
        "build": 93787,
        "status": "not-tested",
        "claim": "Not runtime-tested for this release. Steam is never rejected by channel, build name or version number; loading depends only on the native fingerprint."
      }
    ],
    "releaseGate": "Every included DLL must remove build-name and version allowlists and validate every used native surface before mutation. Steam runtime testing is not required for publication."
  },
  "distribution": {
    "model": "modular-catalog",
    "bundles": 2,
    "expectedGithubAssets": {
      "individualPluginArchives": 24,
      "individualPatchFiles": 17,
      "standaloneTools": 0,
      "optionalBundles": 2,
      "total": 43
    }
  },
  "policy": {
    "requiredIncludedIds": [
      "ruffneckk-cast-triggers",
      "ruffneckk-armageddon-hurricane-ctc-fix",
      "ruffneckk-resistance-floor",
      "ruffneckk-remote-stash",
      "ruffneckk-vendor-stock-refresh",
      "ruffneckk-shadow-master-ai-fix",
      "ruffneckk-isc12",
      "ruffneckk-d2r-save-converter",
      "ruffneckk-mapsense",
      "ruffneckk-extended-act-level-ids"
    ],
    "deniedIncludedIds": [
      "ruffneckk-ground-item-label-limit-64",
      "ruffneckk-ground-item-label-limit-128",
      "ruffneckk-normal-area-scaling"
    ],
    "allowlistRole": "Final artifact paths, versions and SHA-256 only; it must match this registry before packaging.",
    "changelogRole": "Human-readable projection of the release notes recorded on included, removed and deferred entries."
  },
  "components": [
    {
      "id": "ruffneckk-bulk-currency-deposit",
      "name": "Bulk Currency Deposit",
      "kind": "plugin",
      "disposition": "include",
      "changeType": "update",
      "targetVersion": "1.1.2",
      "versionStatus": "locked",
      "asset": "RuffnecKk-bulk-currency-deposit-v1.1.2.zip",
      "sourceRef": "workspace:addons/BulkCurrencyDeposit",
      "releaseNoteCategory": "Fixed",
      "releaseNote": "Includes the Suite 1.3.1 compatibility hotfix.",
      "decision": "Patch release for D2RLoader 1.2.1 compatibility and multiplayer configuration matching.",
      "gates": {
        "source": "passed",
        "build": "passed",
        "battleNetRuntime": "passed",
        "steamRuntime": "not-required",
        "packaging": "passed"
      }
    },
    {
      "id": "ruffneckk-bulk-skill-point-allocation",
      "name": "Bulk Skill Point Allocation",
      "kind": "plugin",
      "disposition": "include",
      "changeType": "retain",
      "targetVersion": "1.3.4",
      "versionStatus": "locked",
      "asset": "RuffnecKk-bulk-skill-point-allocation-v1.3.4.zip",
      "sourceRef": "suite:plugins/bulk-skill-point-allocation",
      "releaseNoteCategory": "Changed",
      "releaseNote": "Uses complete native fingerprint validation without a D2R build-name allowlist.",
      "decision": "Carry the migrated Suite baseline into the current release without a build-version allowlist.",
      "gates": {
        "source": "passed",
        "build": "passed",
        "battleNetRuntime": "passed",
        "steamRuntime": "not-required",
        "packaging": "passed"
      }
    },
    {
      "id": "ruffneckk-burn-damage-fix",
      "name": "Burn Damage Fix",
      "kind": "plugin",
      "disposition": "include",
      "changeType": "update",
      "targetVersion": "1.0.1",
      "versionStatus": "locked",
      "asset": "RuffnecKk-burn-damage-fix-v1.0.1.zip",
      "sourceRef": "workspace:addons/BurnDamageFix",
      "releaseNoteCategory": "Fixed",
      "releaseNote": "Includes the Suite 1.3.1 compatibility hotfix.",
      "decision": "Patch release for D2RLoader 1.2.1 compatibility and multiplayer configuration matching.",
      "gates": {
        "source": "passed",
        "build": "passed",
        "battleNetRuntime": "passed",
        "steamRuntime": "not-required",
        "packaging": "passed"
      }
    },
    {
      "id": "ruffneckk-cast-triggers",
      "name": "Cast Triggers",
      "kind": "plugin",
      "disposition": "include",
      "changeType": "retain",
      "targetVersion": "1.0.0",
      "versionStatus": "locked",
      "asset": "RuffnecKk-cast-triggers-v1.0.0.zip",
      "sourceRef": "workspace:addons/CastTriggers",
      "releaseNoteCategory": "Added",
      "releaseNote": "Adds configurable cast-on-cast, channeling, attack-attempt and combat-outcome item triggers.",
      "decision": "Vincent changed the first public version from 0.1.0 to 1.0.0 on 2026-09-02.",
      "archiveReadme": {
        "include": true,
        "source": "plugins/cast-triggers/README.md",
        "destination": "README.md",
        "sha256": "D48016BF499B95FFB7038039FFEF4B885975C5DC99A9386526156FA417B69252",
        "reviewedBy": "Vincent Barrière",
        "reviewedOn": "2026-09-03",
        "decision": "Vincent reviewed and updated the modder setup guide, then required it inside the individual Cast Triggers release ZIP."
      },
      "gates": {
        "source": "passed",
        "build": "passed",
        "battleNetRuntime": "passed",
        "steamRuntime": "not-required",
        "packaging": "passed"
      }
    },
    {
      "id": "ruffneckk-charm-aura-trigger-fix",
      "name": "Charm Aura Trigger Fix",
      "kind": "plugin",
      "disposition": "include",
      "changeType": "update",
      "targetVersion": "1.6.4",
      "versionStatus": "locked",
      "asset": "RuffnecKk-charm-aura-trigger-fix-v1.6.4.zip",
      "sourceRef": "suite:plugins/charm-aura-trigger-fix",
      "releaseNoteCategory": "Fixed",
      "releaseNote": "Includes the Suite 1.3.1 compatibility hotfix.",
      "decision": "Patch release for D2RLoader 1.2.1 compatibility and multiplayer configuration matching.",
      "gates": {
        "source": "passed",
        "build": "passed",
        "battleNetRuntime": "passed",
        "steamRuntime": "not-required",
        "packaging": "passed"
      }
    },
    {
      "id": "ruffneckk-cube-quick-move",
      "name": "Cube Quick Move",
      "kind": "plugin",
      "disposition": "include",
      "changeType": "update",
      "targetVersion": "1.0.3",
      "versionStatus": "locked",
      "asset": "RuffnecKk-cube-quick-move-v1.0.3.zip",
      "sourceRef": "suite:plugins/cube-quick-move",
      "releaseNoteCategory": "Fixed",
      "releaseNote": "Includes the Suite 1.3.1 compatibility hotfix.",
      "decision": "Patch release for D2RLoader 1.2.1 compatibility and multiplayer configuration matching.",
      "gates": {
        "source": "passed",
        "build": "passed",
        "battleNetRuntime": "passed",
        "steamRuntime": "not-required",
        "packaging": "passed"
      }
    },
    {
      "id": "ruffneckk-enhanced-damage-min-max-fix",
      "name": "Enhanced Damage Min/Max Fix",
      "kind": "plugin",
      "disposition": "include",
      "changeType": "update",
      "targetVersion": "1.2.4",
      "versionStatus": "locked",
      "asset": "RuffnecKk-enhanced-damage-min-max-fix-v1.2.4.zip",
      "sourceRef": "suite:plugins/enhanced-damage-min-max-fix",
      "releaseNoteCategory": "Fixed",
      "releaseNote": "Includes the Suite 1.3.1 compatibility hotfix.",
      "decision": "Patch release for D2RLoader 1.2.1 compatibility and multiplayer configuration matching.",
      "gates": {
        "source": "passed",
        "build": "passed",
        "battleNetRuntime": "passed",
        "steamRuntime": "not-required",
        "packaging": "passed"
      }
    },
    {
      "id": "ruffneckk-equipped-item-to-cube",
      "name": "Equipped Item to Cube",
      "kind": "plugin",
      "disposition": "include",
      "changeType": "retain",
      "targetVersion": "1.0.2",
      "versionStatus": "locked",
      "asset": "RuffnecKk-equipped-item-to-cube-v1.0.2.zip",
      "sourceRef": "suite:plugins/equipped-item-to-cube",
      "releaseNoteCategory": "Changed",
      "releaseNote": "Uses complete native fingerprint validation without a D2R build-name allowlist.",
      "decision": "Carry the migrated Suite baseline into the current release without a build-version allowlist.",
      "gates": {
        "source": "passed",
        "build": "passed",
        "battleNetRuntime": "passed",
        "steamRuntime": "not-required",
        "packaging": "passed"
      }
    },
    {
      "id": "ruffneckk-ethereal-item-rules",
      "name": "Ethereal Item Rules",
      "kind": "plugin",
      "disposition": "include",
      "changeType": "retain",
      "targetVersion": "1.0.2",
      "versionStatus": "locked",
      "asset": "RuffnecKk-ethereal-item-rules-v1.0.2.zip",
      "sourceRef": "suite:plugins/ethereal-item-rules",
      "releaseNoteCategory": "Changed",
      "releaseNote": "Uses complete native fingerprint validation without a D2R build-name allowlist.",
      "decision": "Carry the migrated Suite baseline into the current release without a build-version allowlist.",
      "gates": {
        "source": "passed",
        "build": "passed",
        "battleNetRuntime": "passed",
        "steamRuntime": "not-required",
        "packaging": "passed"
      }
    },
    {
      "id": "ruffneckk-floating-damage",
      "name": "Floating Damage",
      "kind": "plugin",
      "disposition": "include",
      "changeType": "retain",
      "targetVersion": "1.4.2",
      "versionStatus": "locked",